[
  {
    "slug": "operations-order-list",
    "title": "运营订单列表",
    "titleEn": "Operations Order List",
    "summary": "适合高频查询、批量处理和异常追踪的后台列表。",
    "summaryEn": "A back-office list for high-frequency lookup, bulk processing, and exception tracking.",
    "productTypes": ["b2b-admin"],
    "pageTypes": ["list"],
    "layouts": ["sidebar", "table"],
    "moods": ["professional", "dense", "restrained"],
    "states": ["default", "loading", "empty", "error"],
    "scenarios": ["高频扫描", "条件筛选", "批量操作"],
    "scenariosEn": ["High-frequency scanning", "Conditional filtering", "Bulk actions"],
    "structure": ["左侧业务导航", "顶部筛选与主操作", "高密度数据表格", "底部分页"],
    "structureEn": ["Business navigation rail", "Filters and primary action bar", "Dense data table", "Pagination footer"],
    "visualTraits": ["表头和行状态对齐", "颜色只表达语义状态", "次要字段降低对比度"],
    "visualTraitsEn": ["Headers align with row states", "Color carries semantic status only", "Secondary fields recede"],
    "promptHints": {
      "summary": "构建一个面向运营人员的高密度订单列表。",
      "do": ["固定关键列并让表头保持可见", "筛选条件可回显和清空", "批量操作只在选中记录后出现"],
      "avoid": ["把每一行做成独立卡片", "只用颜色区分订单状态"],
      "summaryEn": "Build a dense order list for operations teams.", "doEn": ["Keep key columns and the header visible", "Echo and clear filter values", "Reveal bulk actions only after selection"], "avoidEn": ["Turn every row into a separate card", "Use color as the only order status cue"]
    },
    "demo": "pm/operations-order-list",
    "source": {"kind": "original", "label": "LearnUI PM 原创示例", "license": "MIT"}
  },
  {
    "slug": "executive-metrics-dashboard",
    "title": "经营指标看板",
    "titleEn": "Executive Metrics Dashboard",
    "summary": "用于快速判断趋势、异常和指标关系的数据总览。",
    "summaryEn": "A data overview for reading trends, anomalies, and metric relationships at a glance.",
    "productTypes": ["data-dashboard", "b2b-admin"],
    "pageTypes": ["dashboard"],
    "layouts": ["sidebar", "workbench"],
    "moods": ["professional", "restrained", "dense"],
    "states": ["default", "loading", "error"],
    "scenarios": ["经营复盘", "趋势判断", "异常定位"],
    "scenariosEn": ["Business review", "Trend reading", "Anomaly diagnosis"],
    "structure": ["时间范围与口径说明", "核心指标带", "趋势主图", "异常与构成明细"],
    "structureEn": ["Time range and metric definition", "Core metric strip", "Primary trend chart", "Anomaly and breakdown details"],
    "visualTraits": ["数字与单位分层", "图表颜色保持克制", "异常项优先于装饰信息"],
    "visualTraitsEn": ["Numbers and units have clear hierarchy", "Chart colors stay restrained", "Anomalies outrank decoration"],
    "promptHints": {
      "summary": "构建一个经营指标看板，先展示结论，再提供下钻依据。",
      "do": ["标明时间范围和数据口径", "为趋势变化提供同比或环比", "加载失败时保留其他可用模块"],
      "avoid": ["堆叠无解释的大数字卡片", "每张图使用不同配色"],
      "summaryEn": "Build an executive metrics dashboard that leads with conclusions and supports drill-down.", "doEn": ["State the time range and metric definitions", "Give trend changes a comparison baseline", "Keep other modules usable when a chart fails"], "avoidEn": ["Stack unexplained big-number cards", "Give every chart a different palette"]
    },
    "demo": "pm/executive-metrics-dashboard",
    "source": {"kind": "original", "label": "LearnUI PM 原创示例", "license": "MIT"}
  },
  {
    "slug": "ai-research-workspace",
    "title": "AI 研究工作台",
    "titleEn": "AI Research Workspace",
    "summary": "把资料、对话和生成结果放在同一任务上下文中的三栏工作台。",
    "summaryEn": "A three-pane workspace that keeps sources, conversation, and generated results in one task context.",
    "productTypes": ["ai-tool"],
    "pageTypes": ["workspace"],
    "layouts": ["three-column", "workbench"],
    "moods": ["technical", "immersive", "professional"],
    "states": ["default", "processing", "error", "success"],
    "scenarios": ["资料研究", "AI 生成", "结果校对"],
    "scenariosEn": ["Source research", "AI generation", "Result review"],
    "structure": ["左侧资料树", "中部对话与任务流", "右侧结果预览与引用"],
    "structureEn": ["Source tree", "Conversation and task flow", "Result preview and citations"],
    "visualTraits": ["三栏宽度由任务优先级决定", "生成状态与内容区紧密相连", "引用可回到原文"],
    "visualTraitsEn": ["Pane widths follow task priority", "Generation state stays close to content", "Citations return to source"],
    "promptHints": {
      "summary": "构建一个资料、AI 对话和可编辑结果并行的研究工作台。",
      "do": ["明确区分用户输入、模型输出和引用", "生成中允许取消", "保留失败输入用于重试"],
      "avoid": ["让聊天气泡占据全部页面", "用无限动画代替具体处理状态"],
      "summaryEn": "Build a research workspace with sources, AI conversation, and an editable result side by side.", "doEn": ["Separate user input, model output, and citations", "Allow generation to be cancelled", "Keep failed input available for retry"], "avoidEn": ["Let chat bubbles take over the page", "Replace a concrete processing state with endless animation"]
    },
    "demo": "pm/ai-research-workspace",
    "source": {"kind": "original", "label": "LearnUI PM 原创示例", "license": "MIT"}
  },
  {
    "slug": "course-learning-catalog",
    "title": "课程学习目录",
    "titleEn": "Course Learning Catalog",
    "summary": "兼顾课程发现、学习进度和继续学习入口的教育产品首页。",
    "summaryEn": "An education home page balancing course discovery, learning progress, and a clear continue-learning entry point.",
    "productTypes": ["education"],
    "pageTypes": ["list", "workspace"],
    "layouts": ["sidebar", "card-flow"],
    "moods": ["warm", "lightweight", "professional"],
    "states": ["default", "loading", "empty"],
    "scenarios": ["课程发现", "继续学习", "进度回顾"],
    "scenariosEn": ["Course discovery", "Continue learning", "Progress review"],
    "structure": ["继续学习主入口", "分类与难度筛选", "课程卡片流", "个人学习进度"],
    "structureEn": ["Continue-learning entry point", "Category and difficulty filters", "Course card flow", "Personal progress"],
    "visualTraits": ["课程封面服务于识别而非装饰", "进度信息靠近继续按钮", "筛选条件保持简短"],
    "visualTraitsEn": ["Course covers aid recognition", "Progress sits near Continue", "Filters stay concise"],
    "promptHints": {
      "summary": "构建一个以继续学习和课程发现为核心的课程目录。",
      "do": ["优先展示上次学习位置", "区分未开始、学习中和已完成", "空结果给出清除筛选入口"],
      "avoid": ["每张课程卡展示过多营销文案", "把学习进度藏进详情页"],
      "summaryEn": "Build a course catalog centered on continuing learning and discovering the next course.", "doEn": ["Prioritize the last learning position", "Distinguish not started, in progress, and complete", "Offer a clear path out of empty results"], "avoidEn": ["Pack cards with marketing copy", "Hide progress inside the detail page"]
    },
    "demo": "pm/course-learning-catalog",
    "source": {"kind": "original", "label": "LearnUI PM 原创示例", "license": "MIT"}
  },
  {
    "slug": "mobile-task-inbox",
    "title": "移动任务收件箱",
    "titleEn": "Mobile Task Inbox",
    "summary": "面向单手操作的任务收集、分组和快速完成页面。",
    "summaryEn": "A one-hand mobile task inbox for capture, grouping, and fast completion.",
    "productTypes": ["mobile"],
    "pageTypes": ["list"],
    "layouts": ["single-column"],
    "moods": ["lightweight", "restrained", "warm"],
    "states": ["default", "empty", "success"],
    "scenarios": ["快速记录", "今日处理", "完成反馈"],
    "scenariosEn": ["Quick capture", "Today’s work", "Completion feedback"],
    "structure": ["日期与未完成计数", "快速新增", "按时间分组的任务列表", "底部主导航"],
    "structureEn": ["Date and open-count summary", "Quick add", "Time-grouped task list", "Bottom navigation"],
    "visualTraits": ["触控目标不小于 44px", "完成状态不能只靠删除线表达", "主要操作位于拇指可达区"],
    "visualTraitsEn": ["Touch targets are at least 44px", "Completion is not shown by strike-through alone", "Primary actions stay thumb-reachable"],
    "promptHints": {
      "summary": "构建一个适合单手操作的移动任务收件箱。",
      "do": ["快速新增后保持输入上下文", "完成动作提供可撤销反馈", "离线时保留本地编辑"],
      "avoid": ["在小屏上堆叠多层筛选", "依赖悬停显示关键操作"],
      "summaryEn": "Build a one-hand mobile task inbox for capture, grouping, and fast completion.", "doEn": ["Keep input context after quick add", "Offer undo after completion", "Preserve local edits offline"], "avoidEn": ["Stack layers of filters on a small screen", "Hide key actions behind hover"]
    },
    "demo": "pm/mobile-task-inbox",
    "source": {"kind": "original", "label": "LearnUI PM 原创示例", "license": "MIT"}
  },
  {
    "slug": "product-launch-landing",
    "title": "产品发布落地页",
    "titleEn": "Product Launch Landing Page",
    "summary": "用清晰价值、真实产品画面和单一行动路径完成产品介绍。",
    "summaryEn": "A product launch page built around clear value, real product evidence, and one action path.",
    "productTypes": ["marketing"],
    "pageTypes": ["landing"],
    "layouts": ["split", "single-column"],
    "moods": ["professional", "immersive", "restrained"],
    "states": ["default", "loading", "error", "success"],
    "scenarios": ["产品发布", "线索收集", "功能说明"],
    "scenariosEn": ["Product launch", "Lead capture", "Feature explanation"],
    "structure": ["首屏价值与真实产品视觉", "关键能力证据", "使用方式", "单一转化入口"],
    "structureEn": ["First-screen value and product evidence", "Proof of key capabilities", "How it works", "Single conversion path"],
    "visualTraits": ["首屏只承担一个主要信息", "产品本体在首屏可见", "不同区段使用不同信息构图"],
    "visualTraitsEn": ["The first screen carries one main message", "The product is visible immediately", "Sections use distinct information compositions"],
    "promptHints": {
      "summary": "构建一个直接展示产品价值和真实界面的发布落地页。",
      "do": ["首屏保留下一段内容提示", "只设置一个主要 CTA 意图", "表单错误就地说明"],
      "avoid": ["用抽象渐变代替产品画面", "重复排列相同三列卡片"],
      "summaryEn": "Build a launch page around clear value, real product evidence, and one action path.", "doEn": ["Hint at the next section from the first screen", "Give the page one primary CTA intent", "Explain form errors in place"], "avoidEn": ["Replace product evidence with abstract gradients", "Repeat the same three-card row"]
    },
    "demo": "pm/product-launch-landing",
    "source": {"kind": "original", "label": "LearnUI PM 原创示例", "license": "MIT"}
  },
  {
    "slug": "customer-account-detail",
    "title": "客户账户详情",
    "titleEn": "Customer Account Detail",
    "summary": "汇总客户身份、健康状态、关键关系和最近活动的详情页。",
    "summaryEn": "A customer detail page that brings identity, health, key relationships, and recent activity together.",